Active,Role,Assessment Section Key,Header Key,Rubric Key,Culture Min,Skill Min,Overall Min,Auto Decline Below,Manual Review Band,Auto Booking,Booking Eligible,Notes
TRUE,Service Advisor,ASSESS_SERVICE_ADVISOR,HEADERS_ASSESS_SERVICE_ADVISOR,RUBRIC_SERVICE_ADVISOR,80,75,78,55,56-77,TRUE,TRUE,"Service Advisor candidates must show strong communication, customer trust-building, ownership, pace, and ability to explain diagnostics, timelines, and estimates without pressure."
TRUE,Technician,ASSESS_TECHNICIAN,HEADERS_ASSESS_TECHNICIAN,RUBRIC_TECHNICIAN,75,78,78,55,56-77,TRUE,TRUE,"Technician candidates must show diagnostic discipline, testing-before-replacing mindset, documentation ability, European vehicle experience, and comeback prevention thinking."
TRUE,Lube Tech,ASSESS_LUBE_TECH,HEADERS_ASSESS_LUBE_TECH,RUBRIC_LUBE_TECH,75,65,70,50,51-69,TRUE,TRUE,"Lube Tech candidates must show coachability, safety awareness, basic inspection ability, attention to detail, and readiness to grow into higher-level technical work."
TRUE,Valet / Porter,ASSESS_VALET_PORTER,HEADERS_ASSESS_VALET_PORTER,RUBRIC_VALET_PORTER,80,65,72,50,51-71,TRUE,TRUE,"Valet / Porter candidates must show dependability, professionalism, safe vehicle handling, attention to customer property, and ability to follow process consistently."
TRUE,Parts,ASSESS_PARTS,HEADERS_ASSESS_PARTS,RUBRIC_PARTS,75,72,74,52,53-73,TRUE,TRUE,"Parts candidates must show accuracy, urgency, vendor communication, part matching discipline, ETA communication, and documentation ability."
TRUE,CX / Customer Experience,ASSESS_CX,HEADERS_ASSESS_CX,RUBRIC_CX,82,68,74,52,53-73,TRUE,TRUE,"CX candidates must show hospitality, emotional control, professional communication, follow-through, customer empathy, and ability to protect the Frank’s experience."
TRUE,Admin,ASSESS_ADMIN,HEADERS_ASSESS_ADMIN,RUBRIC_ADMIN,78,70,74,52,53-73,TRUE,TRUE,"Admin candidates must show organization, accuracy, confidentiality, follow-through, communication, and ability to support operations without creating confusion."
TRUE,Shop Foreman,ASSESS_SHOP_FOREMAN,HEADERS_ASSESS_SHOP_FOREMAN,RUBRIC_SHOP_FOREMAN,85,82,84,60,61-83,TRUE,TRUE,"Shop Foreman candidates must show leadership, diagnostic judgment, technician coaching ability, workflow control, quality standards, accountability, and calm decision-making."